<?xml version="1.0" encoding="UTF-8"?>
<!DOCTYPE persoane [
<!ELEMENT persoana (nume, prenume, varsta, telefon, adresa, data_nasterii)>
<!ATTLIST id>
<!ELEMENT nume (#PCDATA)>
<!ELEMENT prenume (#PCDATA)>
<!ELEMENT varsta (#PCDATA)>
<!ELEMENT telefon (#PCDATA)>
<!ELEMENT adresa (strada, numar, localitate, judet, tara, cod_postal)>
<!ELEMENT strada (#PCDATA)>
<!ELEMENT numar (#PCDATA)>
<!ELEMENT localitate (#PCDATA)>
<!ELEMENT judet (#PCDATA)>
<!ELEMENT tara (#PCDATA)>
<!ELEMENT cod_postal (#PCDATA)>
<!ELEMENT data_nasterii (zi, luna, an)>
<!ELEMENT zi (#PCDATA)>
<!ELEMENT luna (#PCDATA)>
<!ELEMENT an (#PCDATA)>
]>
<persoane>
    <persoana id="1">
        <nume>Popescu</nume>
        <prenume>Ion</prenume>
        <varsta>22</varsta>
        <telefon>0747116566</telefon>
        <adresa>
            <strada>Hapau</strada>
            <numar>11</numar>
            <localitate>Dolhasca</localitate>
            <judet>Suceava</judet>
            <tara>Romania</tara>
            <cod_postal>727170</cod_postal>
        </adresa>
        <data_nasterii>
            <zi>5</zi>
            <luna>Iulie</luna>
            <an>2002</an>
        </data_nasterii>
    </persoana>
    <persoana id="2">
        <nume>Birleanu</nume>
        <prenume>Andreea</prenume>
        <varsta>24</varsta>
        <telefon>0730005530</telefon>
        <adresa>
            <strada>Florilor</strada>
            <numar>25</numar>
            <localitate>Iasi</localitate>
            <judet>Iasi</judet>
            <tara>Romania</tara>
            <cod_postal>700756</cod_postal>
        </adresa>
        <data_nasterii>
            <zi>23</zi>
            <luna>Septembrie</luna>
            <an>2000</an>
        </data_nasterii>
    </persoana>
    <persoana id="3">
        <nume>Puravet</nume>
        <prenume>Adina</prenume>
        <varsta>34</varsta>
        <telefon>0754506323</telefon>
        <adresa>
            <strada>Alee Nicolina</strada>
            <numar>30</numar>
            <localitate>Bucuresti</localitate>
            <judet>Ilfov</judet>
            <tara>Romania</tara>
            <cod_postal>737170</cod_postal>
        </adresa>
        <data_nasterii>
            <zi>14</zi>
            <luna>Martie</luna>
            <an>1995</an>
        </data_nasterii>
    </persoana>
    <persoana id="4">
        <nume>Stefan</nume>
        <prenume>Iulian</prenume>
        <varsta>34</varsta>
        <telefon>0753608329</telefon>
        <adresa>
            <strada>Piata Unirii</strada>
            <numar>10</numar>
            <localitate>Pascani</localitate>
            <judet>Iasi</judet>
            <tara>Romania</tara>
            <cod_postal>747134</cod_postal>
        </adresa>
        <data_nasterii>
            <zi>40</zi>
            <luna>August</luna>
            <an>1990</an>
        </data_nasterii>
    </persoana>
    <persoana id="5">
        <nume>Ionescu</nume>
        <prenume>Ana</prenume>
        <varsta>26</varsta>
        <telefon>0711349876</telefon>
        <adresa>
            <strada>Bancii</strada>
            <numar>3</numar>
            <localitate>Falticeni</localitate>
            <judet>Suceava</judet>
            <tara>Romania</tara>
            <cod_postal>787179</cod_postal>
        </adresa>
        <data_nasterii>
            <zi>27</zi>
            <luna>Ianuarie</luna>
            <an>1999</an>
        </data_nasterii>
    </persoana>
</persoane>